,hasResults,protocolSection.identificationModule.nctId,protocolSection.identificationModule.orgStudyIdInfo.id,protocolSection.identificationModule.secondaryIdInfos,protocolSection.identificationModule.organization.fullName,protocolSection.identificationModule.organization.class,protocolSection.identificationModule.briefTitle,protocolSection.identificationModule.officialTitle,protocolSection.statusModule.statusVerifiedDate,protocolSection.statusModule.overallStatus,protocolSection.statusModule.expandedAccessInfo.hasExpandedAccess,protocolSection.statusModule.startDateStruct.date,protocolSection.statusModule.startDateStruct.type,protocolSection.statusModule.primaryCompletionDateStruct.date,protocolSection.statusModule.primaryCompletionDateStruct.type,protocolSection.statusModule.completionDateStruct.date,protocolSection.statusModule.completionDateStruct.type,protocolSection.statusModule.studyFirstSubmitDate,protocolSection.statusModule.studyFirstSubmitQcDate,protocolSection.statusModule.studyFirstPostDateStruct.date,protocolSection.statusModule.studyFirstPostDateStruct.type,protocolSection.statusModule.resultsFirstSubmitDate,protocolSection.statusModule.resultsFirstSubmitQcDate,protocolSection.statusModule.resultsFirstPostDateStruct.date,protocolSection.statusModule.resultsFirstPostDateStruct.type,protocolSection.statusModule.lastUpdateSubmitDate,protocolSection.statusModule.lastUpdatePostDateStruct.date,protocolSection.statusModule.lastUpdatePostDateStruct.type,protocolSection.sponsorCollaboratorsModule.responsibleParty.type,protocolSection.sponsorCollaboratorsModule.leadSponsor.name,protocolSection.sponsorCollaboratorsModule.leadSponsor.class,protocolSection.sponsorCollaboratorsModule.collaborators,protocolSection.oversightModule.oversightHasDmc,protocolSection.oversightModule.isFdaRegulatedDrug,protocolSection.oversightModule.isFdaRegulatedDevice,protocolSection.descriptionModule.briefSummary,protocolSection.descriptionModule.detailedDescription,protocolSection.conditionsModule.conditions,protocolSection.conditionsModule.keywords,protocolSection.designModule.studyType,protocolSection.designModule.phases,protocolSection.designModule.designInfo.allocation,protocolSection.designModule.designInfo.interventionModel,protocolSection.designModule.designInfo.primaryPurpose,protocolSection.designModule.designInfo.maskingInfo.masking,protocolSection.designModule.designInfo.maskingInfo.whoMasked,protocolSection.designModule.enrollmentInfo.count,protocolSection.designModule.enrollmentInfo.type,protocolSection.armsInterventionsModule.armGroups,protocolSection.armsInterventionsModule.interventions,protocolSection.outcomesModule.primaryOutcomes,protocolSection.outcomesModule.secondaryOutcomes,protocolSection.eligibilityModule.eligibilityCriteria,protocolSection.eligibilityModule.healthyVolunteers,protocolSection.eligibilityModule.sex,protocolSection.eligibilityModule.minimumAge,protocolSection.eligibilityModule.stdAges,protocolSection.contactsLocationsModule.overallOfficials,protocolSection.contactsLocationsModule.locations,protocolSection.referencesModule.references,protocolSection.referencesModule.seeAlsoLinks,protocolSection.ipdSharingStatementModule.ipdSharing,protocolSection.ipdSharingStatementModule.description,protocolSection.ipdSharingStatementModule.url,resultsSection.participantFlowModule.groups,resultsSection.participantFlowModule.periods,resultsSection.baselineCharacteristicsModule.populationDescription,resultsSection.baselineCharacteristicsModule.groups,resultsSection.baselineCharacteristicsModule.denoms,resultsSection.baselineCharacteristicsModule.measures,resultsSection.outcomeMeasuresModule.outcomeMeasures,resultsSection.adverseEventsModule.frequencyThreshold,resultsSection.adverseEventsModule.timeFrame,resultsSection.adverseEventsModule.description,resultsSection.adverseEventsModule.eventGroups,resultsSection.adverseEventsModule.seriousEvents,resultsSection.adverseEventsModule.otherEvents,resultsSection.moreInfoModule.certainAgreement.piSponsorEmployee,resultsSection.moreInfoModule.certainAgreement.restrictionType,resultsSection.moreInfoModule.certainAgreement.restrictiveAgreement,resultsSection.moreInfoModule.certainAgreement.otherDetails,resultsSection.moreInfoModule.pointOfContact.title,resultsSection.moreInfoModule.pointOfContact.organization,resultsSection.moreInfoModule.pointOfContact.email,resultsSection.moreInfoModule.pointOfContact.phone,documentSection.largeDocumentModule.largeDocs,derivedSection.miscInfoModule.versionHolder,derivedSection.conditionBrowseModule.meshes,derivedSection.conditionBrowseModule.ancestors,derivedSection.conditionBrowseModule.browseLeaves,derivedSection.conditionBrowseModule.browseBranches,derivedSection.interventionBrowseModule.meshes,derivedSection.interventionBrowseModule.ancestors,derivedSection.interventionBrowseModule.browseLeaves,derivedSection.interventionBrowseModule.browseBranches
0,True,NCT02709486,A4091057,"[{'id': '2013-004508-21', 'type': 'EUDRACT_NUMBER'}, {'id': 'OA 6-MONTH EU STUDY', 'type': 'OTHER', 'domain': 'Alias Study Number'}]",Pfizer,INDUSTRY,Study of the Analgesic Efficacy and Safety of Subcutaneous Tanezumab in Subjects With Osteoarthritis of the Hip or Knee.,"A PHASE 3 RANDOMIZED, DOUBLE-BLIND, PLACEBO-CONTROLLED, MULTICENTER STUDY OF THE ANALGESIC EFFICACY AND SAFETY OF THE SUBCUTANEOUS ADMINISTRATION OF TANEZUMAB IN SUBJECTS WITH OSTEOARTHRITIS OF THE HIP OR KNEE",2019-06,COMPLETED,False,2016-03-02,ACTUAL,2018-06-08,ACTUAL,2018-11-14,ACTUAL,2016-02-26,2016-03-10,2016-03-16,ESTIMATED,2019-06-06,2019-06-06,2019-06-26,ACTUAL,2019-06-06,2019-06-26,ACTUAL,SPONSOR,Pfizer,INDUSTRY,"[{'name': 'Eli Lilly and Company', 'class': 'INDUSTRY'}]",True,True,False,"Tanezumab is a monoclonal antibody that binds to and inhibits the actions of nerve growth factor (NGF). The Nerve Growth Factor Inhibitor (NGFI) class may offer an important breakthrough in the treatment of chronic pain and is under clinical investigation for the treatment of pain associated with osteoarthritis or other chronic pain conditions.

The primary objective of this study is to demonstrate superior efficacy of tanezumab 5 mg and 2.5 mg administered subcutaneously (SC) every 8 weeks versus placebo at Week 24 in subjects with osteoarthritis of the knee or hip. The 2.5 mg dose was shown to provide efficacy benefits with a favorable safety profile when administered intravenously in previous Phase 3 clinical trials. The 5 mg dose is expected to provide added efficacy benefit over the 2.5 mg dose based on data from previous studies.","This is a randomized, double blind, placebo controlled, parallel group multicenter Phase 3 study of the efficacy and safety of tanezumab when administered by SC injection for 24 weeks compared to placebo in subjects with osteoarthritis of the knee or hip. A total of approximately 810 subjects will be randomized to 1 of 3 treatment groups in a 1:1:1 ratio (ie, 270/group). The randomization will be stratified by index joint (hip or knee), and most severe Kellgren-Lawrence grade (of any knee or hip joint) at study entry (grade 2, 3 or 4). Subjects will receive up to three SC doses of one of the following treatments at an 8-week interval between each injection:

1. tanezumab 2.5 mg;
2. tanezumab 5 mg;
3. Placebo to match tanezumab. The study is designed with a total (post-randomization) duration of 48 weeks and will consist of three periods: Screening (up to 37 days), Double-blind Treatment (24 weeks) and Safety Follow-up (24 weeks). The Screening Period (beginning up to 37 days prior to Randomization) includes a Washout Period (lasting a minimum of 2 days for all prohibited pain medications), if required, and an Initial Pain Assessment Period (the 7 days prior to Randomization/Baseline).

